{"schema_version":"1.0","task_id":"TASK-0001","decision_unit_id":"DU-001","approval_type":"code","actor":"human@example.com","reason":"Reviewed implementation","spec_sha256":"aaaaaaaaaaaaaaaaaaaaaaaaaaaaaaaaaaaaaaaaaaaaaaaaaaaaaaaaaaaaaaaa","policy_sha256":"bbbbbbbbbbbbbbbbbbbbbbbbbbbbbbbbbbbbbbbbbbbbbbbbbbbbbbbbbbbbbbbb","subject_commit":"1111111111111111111111111111111111111111","approved_at":"2026-08-20T05:00:00Z"}
