[
  {
    "actor": "project-owner",
    "approval_type": "spec",
    "approved_at": "2026-10-30T18:18:30Z",
    "base_commit": "6f1aa18242e10d08e04a99861951dbda91def9fc",
    "decision_unit_id": "DU-001",
    "policy_sha256": "13fd009fd3d31095d255af6e110a1e41e5c9b03c2bc27837fa317c6cac28ed21",
    "reason": "常设授权：独立设计审核 APPROVE 且无未关闭 critical/high；仅授权冻结规格范围内的本地实施，不授权外部动作或合并。",
    "schema_version": "1.0",
    "spec_sha256": "6dfaf1aa64a2d0b6306f23a3920e6ffbf2a369a97d0692fc12d7500e141a6d66",
    "subject_commit": "6f1aa18242e10d08e04a99861951dbda91def9fc",
    "task_id": "TASK-0120"
  },
  {
    "actor": "project-owner",
    "approval_type": "code",
    "approved_at": "2026-10-30T18:38:39Z",
    "base_commit": "6f1aa18242e10d08e04a99861951dbda91def9fc",
    "decision_unit_id": "DU-001",
    "evidence_sha256": "deaa5152fdf5e95f5673853bcaa6b5514ee0eeb7d7eac4583e4ebd21098ede5b",
    "policy_sha256": "13fd009fd3d31095d255af6e110a1e41e5c9b03c2bc27837fa317c6cac28ed21",
    "reason": "常设授权：当前 subject 独立实现审核 APPROVE，原生 V1 的必需检查通过且无未关闭 critical/high；仅批准范围内代码，外部动作需分别核验。",
    "schema_version": "1.0",
    "spec_sha256": "6dfaf1aa64a2d0b6306f23a3920e6ffbf2a369a97d0692fc12d7500e141a6d66",
    "subject_commit": "669364e00e4b045760e03ccdfecdde25b7a47f11",
    "task_id": "TASK-0120"
  },
  {
    "action_sha256": "29431fcec735ce54f0d09df3e48f62b5c9d6c7621842b1efd36516b242b89adc",
    "actor": "project-owner",
    "approval_type": "action",
    "approved_at": "2026-10-30T18:40:20Z",
    "base_commit": "6f1aa18242e10d08e04a99861951dbda91def9fc",
    "decision_unit_id": "DU-001",
    "expires_at": "2026-10-30T20:40:20Z",
    "policy_sha256": "13fd009fd3d31095d255af6e110a1e41e5c9b03c2bc27837fa317c6cac28ed21",
    "reason": "所有者已授权解决公开交付的已知路径隐私阻碍并在门禁通过后交付；记录仅限指定分支及提交的单次 push，不转移旧任务禁令。",
    "schema_version": "1.0",
    "single_use": true,
    "spec_sha256": "6dfaf1aa64a2d0b6306f23a3920e6ffbf2a369a97d0692fc12d7500e141a6d66",
    "subject_commit": "669364e00e4b045760e03ccdfecdde25b7a47f11",
    "task_id": "TASK-0120"
  },
  {
    "action_sha256": "7db93627550e1dabced3d6c56eba40e00ac70df3f6485ed3cbcaa30606f6cb5b",
    "actor": "project-owner",
    "approval_type": "action",
    "approved_at": "2026-10-30T18:42:13Z",
    "base_commit": "6f1aa18242e10d08e04a99861951dbda91def9fc",
    "decision_unit_id": "DU-001",
    "expires_at": "2026-10-30T20:42:13Z",
    "policy_sha256": "13fd009fd3d31095d255af6e110a1e41e5c9b03c2bc27837fa317c6cac28ed21",
    "reason": "依据所有者对已知路径隐私修复和条件性交付的授权，记录单次创建指定目标与版本 PR；合并须另行核验及记录。",
    "schema_version": "1.0",
    "single_use": true,
    "spec_sha256": "6dfaf1aa64a2d0b6306f23a3920e6ffbf2a369a97d0692fc12d7500e141a6d66",
    "subject_commit": "669364e00e4b045760e03ccdfecdde25b7a47f11",
    "task_id": "TASK-0120"
  },
  {
    "action_sha256": "9d7dd25c6ff2ddf606fbb2e28a6f3956d4a7387f799b6a522b8222edbc70b934",
    "actor": "project-owner",
    "approval_type": "action",
    "approved_at": "2026-10-30T18:49:45Z",
    "base_commit": "6f1aa18242e10d08e04a99861951dbda91def9fc",
    "decision_unit_id": "DU-001",
    "expires_at": "2026-10-30T20:49:45Z",
    "policy_sha256": "13fd009fd3d31095d255af6e110a1e41e5c9b03c2bc27837fa317c6cac28ed21",
    "reason": "依据所有者对该路径隐私修复及必需检查通过后条件性交付的授权，记录单次 PR 135 merge commit；服务器自动删除仅限本次已合并源分支，提交须通过合并记录保持可达。",
    "schema_version": "1.0",
    "single_use": true,
    "spec_sha256": "6dfaf1aa64a2d0b6306f23a3920e6ffbf2a369a97d0692fc12d7500e141a6d66",
    "subject_commit": "669364e00e4b045760e03ccdfecdde25b7a47f11",
    "task_id": "TASK-0120"
  }
]
