[
  {
    "actor": "project-owner",
    "approval_type": "spec",
    "approved_at": "2026-10-09T15:37:31Z",
    "base_commit": "61eeff3f15676d2e909227acabd473c66ac3d62f",
    "decision_unit_id": "DU-001",
    "policy_sha256": "b87e94fe0ec1a9a7c028b7e8019cf75b286c9af01f7c2ab89af65c3f5c21edf9",
    "reason": "按项目所有者在会话中的预授权（“C & D”）记录：冻结规格 662f8e515d3da1a34f29f427b415fb9fd05287908787a87947749c49f997225d 与预告的收窄范围一致（仅按审核意见明确 YAML 缓存要求），独立设计审核 REV-0002 为 APPROVE，路由 REVIEW；不批准推送、合并或任何外部动作。",
    "schema_version": "1.0",
    "spec_sha256": "662f8e515d3da1a34f29f427b415fb9fd05287908787a87947749c49f997225d",
    "subject_commit": "61eeff3f15676d2e909227acabd473c66ac3d62f",
    "task_id": "TASK-0073"
  },
  {
    "actor": "project-owner",
    "approval_type": "code",
    "approved_at": "2026-10-09T22:12:24Z",
    "base_commit": "61eeff3f15676d2e909227acabd473c66ac3d62f",
    "decision_unit_id": "DU-001",
    "evidence_sha256": "c349586777f6790f8af726f9c0ac0bb2226c0ac723a60acb991ff40c27a1a8d9",
    "policy_sha256": "b87e94fe0ec1a9a7c028b7e8019cf75b286c9af01f7c2ab89af65c3f5c21edf9",
    "reason": "项目所有者在会话中明确回复“批准”，批准 TASK-0073 代码 subject 26e745177a26c200d427cd1d8d506a8b777dac74（V1 evidence passed，实现审核 REV-0003 APPROVE）；不批准推送、合并或任何外部动作。",
    "schema_version": "1.0",
    "spec_sha256": "662f8e515d3da1a34f29f427b415fb9fd05287908787a87947749c49f997225d",
    "subject_commit": "26e745177a26c200d427cd1d8d506a8b777dac74",
    "task_id": "TASK-0073"
  }
]
