[
  {
    "actor": "owner-authorized-root",
    "approval_type": "spec",
    "approved_at": "2026-10-01T16:54:03Z",
    "base_commit": "6c28ca605bec9c4dfeaf7ff7c7de8a6d4207d06a",
    "decision_unit_id": "DU-001",
    "policy_sha256": "d21a386779147dfad962a0fc0656bef61bc581e27f63c4789dcc06520fa10ff1",
    "reason": "Bind the existing explicit owner authorization for eligible completion, necessary approvals, push and merge to current frozen TASK-0059 spec cd3a5cc45c1e5c3b90d0f3daccf7396b2c7def6083b1a9072ec135731a026ec3 and actual independent Design APPROVE; preserve all selected checks and exact-head protected publication conditions.",
    "schema_version": "1.0",
    "spec_sha256": "cd3a5cc45c1e5c3b90d0f3daccf7396b2c7def6083b1a9072ec135731a026ec3",
    "subject_commit": "6c28ca605bec9c4dfeaf7ff7c7de8a6d4207d06a",
    "task_id": "TASK-0059"
  },
  {
    "actor": "owner-authorized-root",
    "approval_type": "code",
    "approved_at": "2026-10-01T17:32:59Z",
    "base_commit": "6c28ca605bec9c4dfeaf7ff7c7de8a6d4207d06a",
    "decision_unit_id": "DU-001",
    "evidence_sha256": "a7188b0af59006d9fe1af12eaa8323d39c2680a19084222b36b0dd2b15c53516",
    "policy_sha256": "d21a386779147dfad962a0fc0656bef61bc581e27f63c4789dcc06520fa10ff1",
    "reason": "Existing explicit owner authorization covers completion and necessary approvals; current fixed source S, complete original native V1, actual independent Design and Implementation APPROVE and byte-valid package are verified. This code approval does not claim remote CI or merge.",
    "schema_version": "1.0",
    "spec_sha256": "cd3a5cc45c1e5c3b90d0f3daccf7396b2c7def6083b1a9072ec135731a026ec3",
    "subject_commit": "6c28ca605bec9c4dfeaf7ff7c7de8a6d4207d06a",
    "task_id": "TASK-0059"
  },
  {
    "action_sha256": "5f8de567e6f9942d86c0f97115cc346e1bf041edbc2390a51cf227ce4fa0ec1e",
    "actor": "owner-authorized-root",
    "approval_type": "action",
    "approved_at": "2026-10-01T17:40:23Z",
    "base_commit": "6c28ca605bec9c4dfeaf7ff7c7de8a6d4207d06a",
    "decision_unit_id": "DU-001",
    "expires_at": "2026-10-01T17:55:23.108058+00:00",
    "policy_sha256": "d21a386779147dfad962a0fc0656bef61bc581e27f63c4789dcc06520fa10ff1",
    "reason": "Existing explicit owner push authorization bound once to exact Q, fresh main/protection/repo/PR/predecessor and ordinary fast-forward command; successful readback remains required.",
    "schema_version": "1.0",
    "single_use": true,
    "spec_sha256": "cd3a5cc45c1e5c3b90d0f3daccf7396b2c7def6083b1a9072ec135731a026ec3",
    "subject_commit": "6c28ca605bec9c4dfeaf7ff7c7de8a6d4207d06a",
    "task_id": "TASK-0059"
  },
  {
    "action_sha256": "7baafd24eb1b3d17aeab0a458e56929533921fd4bf09a81b6c0552ae5ec95abf",
    "actor": "owner-authorized-root",
    "approval_type": "action",
    "approved_at": "2026-10-01T17:42:56Z",
    "base_commit": "6c28ca605bec9c4dfeaf7ff7c7de8a6d4207d06a",
    "decision_unit_id": "DU-001",
    "expires_at": "2026-10-01T17:57:56.025968+00:00",
    "policy_sha256": "d21a386779147dfad962a0fc0656bef61bc581e27f63c4789dcc06520fa10ff1",
    "reason": "Existing explicit owner publication authority bound once to current exact remote Q/B/PR44 and independently reviewed title/body bytes; update existing PR only.",
    "schema_version": "1.0",
    "single_use": true,
    "spec_sha256": "cd3a5cc45c1e5c3b90d0f3daccf7396b2c7def6083b1a9072ec135731a026ec3",
    "subject_commit": "6c28ca605bec9c4dfeaf7ff7c7de8a6d4207d06a",
    "task_id": "TASK-0059"
  },
  {
    "action_sha256": "a44b2bea2e50775c9b61ff308b7889d95005f0761561bb1ad00cc4942b50ddd3",
    "actor": "owner-authorized-root",
    "approval_type": "action",
    "approved_at": "2026-10-01T17:43:31Z",
    "base_commit": "6c28ca605bec9c4dfeaf7ff7c7de8a6d4207d06a",
    "decision_unit_id": "DU-001",
    "expires_at": "2026-10-01T17:58:30.945138+00:00",
    "policy_sha256": "d21a386779147dfad962a0fc0656bef61bc581e27f63c4789dcc06520fa10ff1",
    "reason": "Existing explicit owner authority binds fresh003 to exact Q/B/PR44 and correct literal independently reviewed title/body; earlier002 wrong parameter title caught before external invocation and retained unused.",
    "schema_version": "1.0",
    "single_use": true,
    "spec_sha256": "cd3a5cc45c1e5c3b90d0f3daccf7396b2c7def6083b1a9072ec135731a026ec3",
    "subject_commit": "6c28ca605bec9c4dfeaf7ff7c7de8a6d4207d06a",
    "task_id": "TASK-0059"
  }
]
