[
  {
    "actor": "/user",
    "approval_type": "spec",
    "approved_at": "2026-08-27T11:38:09Z",
    "base_commit": "7c0bfd807954df8be934d99c7e0a565e4fa2ddcb",
    "decision_unit_id": "DU-001",
    "policy_sha256": "f4854d7fa05e5bddc21303350476bf47568bfe50f64c9d1f9199c0d744321bbf",
    "reason": "用户批准 TASK-0025 按分类输入 c5c68affd65005928ba41982d87ed7830450e8f9a60d69e39015669d223efe0b、Policy f4854d7fa05e5bddc21303350476bf47568bfe50f64c9d1f9199c0d744321bbf、冻结规格 b616f9993b1eaa0d3fd65f9cf94562dfba603ace668a4a5fb23d8a754925c780，基于 REV-0043 / context cff3fbfa9e2c6dad268b320060dd3d57bbcc4d3b8f6106d850d7410645ab905f 批准 spec，并按 REVIEW / V2 进入实现；每个 current subject 的 targeted mutation 仍须另行 single-use action approval，不授权任何远程操作。",
    "schema_version": "1.0",
    "spec_sha256": "b616f9993b1eaa0d3fd65f9cf94562dfba603ace668a4a5fb23d8a754925c780",
    "subject_commit": "7c0bfd807954df8be934d99c7e0a565e4fa2ddcb",
    "task_id": "TASK-0025"
  },
  {
    "actor": "/user",
    "approval_type": "spec",
    "approved_at": "2026-08-27T11:48:19Z",
    "base_commit": "7c0bfd807954df8be934d99c7e0a565e4fa2ddcb",
    "decision_unit_id": "DU-001",
    "policy_sha256": "f4854d7fa05e5bddc21303350476bf47568bfe50f64c9d1f9199c0d744321bbf",
    "reason": "用户批准 TASK-0025 按分类输入 36500db4687910d92260c80b48ede24ce9a740ae7f5f4bde5cb77f5e29879e50、Policy f4854d7fa05e5bddc21303350476bf47568bfe50f64c9d1f9199c0d744321bbf、冻结规格 625ac850cfbfedc05c5af636b4f274faacc8325aa806caee7f47f9ec16bb5a4c，基于 REV-0044 / context 1833cc40e1f5a4bdd5e7ce59e2233965325dce8b30ecf1c94ddfa45586b790e7 重新批准 spec，并按 REVIEW / V2 继续实现；保留现有四个 H1 文件，并仅授权新增空的 tests/acceptance/__init__.py；每个 current subject 的 targeted mutation 仍须另行 single-use action approval，不授权任何远程操作。",
    "schema_version": "1.0",
    "spec_sha256": "625ac850cfbfedc05c5af636b4f274faacc8325aa806caee7f47f9ec16bb5a4c",
    "subject_commit": "7c0bfd807954df8be934d99c7e0a565e4fa2ddcb",
    "task_id": "TASK-0025"
  },
  {
    "action_sha256": "9740af8fafb53760e829f94fd3c34d252a742fd42f2928e16272f32ee91d2cfa",
    "actor": "/user",
    "approval_type": "action",
    "approved_at": "2026-08-27T12:18:01Z",
    "base_commit": "7c0bfd807954df8be934d99c7e0a565e4fa2ddcb",
    "decision_unit_id": "DU-001",
    "expires_at": "2026-08-28T12:30:00Z",
    "policy_sha256": "f4854d7fa05e5bddc21303350476bf47568bfe50f64c9d1f9199c0d744321bbf",
    "reason": "用户批准 TASK-0025 按行动摘要 9740af8fafb53760e829f94fd3c34d252a742fd42f2928e16272f32ee91d2cfa、subject fe30565e669aa047088b0c25c085effeb2b4bdbc 执行一次 H1 targeted mutation；single-use，禁止任何远程操作。",
    "schema_version": "1.0",
    "single_use": true,
    "spec_sha256": "625ac850cfbfedc05c5af636b4f274faacc8325aa806caee7f47f9ec16bb5a4c",
    "subject_commit": "fe30565e669aa047088b0c25c085effeb2b4bdbc",
    "task_id": "TASK-0025"
  },
  {
    "actor": "/user",
    "approval_type": "spec",
    "approved_at": "2026-08-27T13:20:30Z",
    "base_commit": "7c0bfd807954df8be934d99c7e0a565e4fa2ddcb",
    "decision_unit_id": "DU-001",
    "policy_sha256": "f4854d7fa05e5bddc21303350476bf47568bfe50f64c9d1f9199c0d744321bbf",
    "reason": "User approved frozen spec 04f951e922a1183b750111b101b9e47532c9bd9261225c289e6faa5237262318 under classification 2d6cc68d05c4b89d0749700f71ddd98c1c3336cf7d227d59425af802c33e4bd4, Policy f4854d7fa05e5bddc21303350476bf47568bfe50f64c9d1f9199c0d744321bbf, and REV-0046 context cbdf00194a21d792a13f7b14c75298b1cf1bff67a479feabe5a413c1876dc599; continue REVIEW/V2 implementation only, with no targeted mutation or remote operation authorized.",
    "schema_version": "1.0",
    "spec_sha256": "04f951e922a1183b750111b101b9e47532c9bd9261225c289e6faa5237262318",
    "subject_commit": "fe30565e669aa047088b0c25c085effeb2b4bdbc",
    "task_id": "TASK-0025"
  },
  {
    "action_sha256": "f743b0607e76d4c2dde436d9029919936c0806785320a3bb823336f876e06aa6",
    "actor": "/user",
    "approval_type": "action",
    "approved_at": "2026-08-27T13:54:14Z",
    "base_commit": "7c0bfd807954df8be934d99c7e0a565e4fa2ddcb",
    "decision_unit_id": "DU-001",
    "expires_at": "2026-08-29T00:00:00Z",
    "policy_sha256": "f4854d7fa05e5bddc21303350476bf47568bfe50f64c9d1f9199c0d744321bbf",
    "reason": "User approved TASK-0025 action digest f743b0607e76d4c2dde436d9029919936c0806785320a3bb823336f876e06aa6 for subject f08b0b8cfc3c6b3f81ff4ddba0dc68cb6b2b3694 as one corrected H1 targeted mutation; single-use and no remote operations.",
    "schema_version": "1.0",
    "single_use": true,
    "spec_sha256": "04f951e922a1183b750111b101b9e47532c9bd9261225c289e6faa5237262318",
    "subject_commit": "f08b0b8cfc3c6b3f81ff4ddba0dc68cb6b2b3694",
    "task_id": "TASK-0025"
  },
  {
    "action_sha256": "f3b1f40508385614ba1dcdcee97b8bbfb65b979948d652220a0be3c747dad1ff",
    "actor": "/user",
    "approval_type": "action",
    "approved_at": "2026-08-27T14:38:26Z",
    "base_commit": "7c0bfd807954df8be934d99c7e0a565e4fa2ddcb",
    "decision_unit_id": "DU-001",
    "expires_at": "2026-08-29T12:00:00Z",
    "policy_sha256": "f4854d7fa05e5bddc21303350476bf47568bfe50f64c9d1f9199c0d744321bbf",
    "reason": "User approved TASK-0025 action digest f3b1f40508385614ba1dcdcee97b8bbfb65b979948d652220a0be3c747dad1ff for subject 7191ca4c9c0bc23b75af9599ebb381ed077aa081 as one H2 targeted mutation; single-use and no remote operations.",
    "schema_version": "1.0",
    "single_use": true,
    "spec_sha256": "04f951e922a1183b750111b101b9e47532c9bd9261225c289e6faa5237262318",
    "subject_commit": "7191ca4c9c0bc23b75af9599ebb381ed077aa081",
    "task_id": "TASK-0025"
  },
  {
    "action_sha256": "a9d4a2898b62772b0737e39399262cf2a8ca714b2f0427e3e2eb88a7e7941103",
    "actor": "/user",
    "approval_type": "action",
    "approved_at": "2026-08-27T15:09:02Z",
    "base_commit": "7c0bfd807954df8be934d99c7e0a565e4fa2ddcb",
    "decision_unit_id": "DU-001",
    "expires_at": "2026-08-29T12:00:00Z",
    "policy_sha256": "f4854d7fa05e5bddc21303350476bf47568bfe50f64c9d1f9199c0d744321bbf",
    "reason": "User approved TASK-0025 action digest a9d4a2898b62772b0737e39399262cf2a8ca714b2f0427e3e2eb88a7e7941103 for subject 7191ca4c9c0bc23b75af9599ebb381ed077aa081 as one H2 V2 retry targeted mutation; single-use and no remote operations. Prior action f3b1f40508385614ba1dcdcee97b8bbfb65b979948d652220a0be3c747dad1ff remains consumed and non-reusable.",
    "schema_version": "1.0",
    "single_use": true,
    "spec_sha256": "04f951e922a1183b750111b101b9e47532c9bd9261225c289e6faa5237262318",
    "subject_commit": "7191ca4c9c0bc23b75af9599ebb381ed077aa081",
    "task_id": "TASK-0025"
  },
  {
    "actor": "/user",
    "approval_type": "code",
    "approved_at": "2026-08-27T15:51:04Z",
    "base_commit": "7c0bfd807954df8be934d99c7e0a565e4fa2ddcb",
    "decision_unit_id": "DU-001",
    "evidence_sha256": "4c5c8806a1a31977bb0ed0848294f30bf87ab36109f8edd9cb3bd7779b3f32e3",
    "policy_sha256": "f4854d7fa05e5bddc21303350476bf47568bfe50f64c9d1f9199c0d744321bbf",
    "reason": "User approved TASK-0025 code bound to subject 7191ca4c9c0bc23b75af9599ebb381ed077aa081, canonical evidence 4c5c8806a1a31977bb0ed0848294f30bf87ab36109f8edd9cb3bd7779b3f32e3, implementation review REV-0048 context 63a0a3df4196b1cec9b2f79e5f0e21065c54acf990f8869b5bc2bc63eccfd6e7, and Policy f4854d7fa05e5bddc21303350476bf47568bfe50f64c9d1f9199c0d744321bbf; authorized one local read-only Gate and no remote operations.",
    "schema_version": "1.0",
    "spec_sha256": "04f951e922a1183b750111b101b9e47532c9bd9261225c289e6faa5237262318",
    "subject_commit": "7191ca4c9c0bc23b75af9599ebb381ed077aa081",
    "task_id": "TASK-0025"
  }
]
