[
  {
    "actor": "human-user",
    "approval_type": "spec",
    "approved_at": "2026-08-29T10:41:31Z",
    "base_commit": "3f3ead9eeb3cc1039be58627994a3a0d58102534",
    "decision_unit_id": "DU-001",
    "policy_sha256": "f4854d7fa05e5bddc21303350476bf47568bfe50f64c9d1f9199c0d744321bbf",
    "reason": "User explicitly approved frozen spec 657bac588589c0fabb9c8d6a108ab9077cd101c9648f55d0d3f5e71299f06877 under classification 28204d9e485e11ca0948982038798e99f8148512a491550e80f4ebeb1e14a75a and Policy f4854d7fa05e5bddc21303350476bf47568bfe50f64c9d1f9199c0d744321bbf. REV-0055 reasserts the identical approved context 0d3efee5c9ef2b73936729c5e6fecd88cc2e10756b7ff33823d83acff91e0e71 after the historical finding-resolution revision; bounded implementation only, excluding mutation, temporary cleanup, push, merge, or remote actions.",
    "schema_version": "1.0",
    "spec_sha256": "657bac588589c0fabb9c8d6a108ab9077cd101c9648f55d0d3f5e71299f06877",
    "subject_commit": "3f3ead9eeb3cc1039be58627994a3a0d58102534",
    "task_id": "TASK-0028"
  },
  {
    "action_sha256": "7dcbd975b1721e6e314e8955b012aa7b5b82dcdacade06b1d428214c3e39c0dc",
    "actor": "human-user",
    "approval_type": "action",
    "approved_at": "2026-08-29T13:48:04Z",
    "base_commit": "3f3ead9eeb3cc1039be58627994a3a0d58102534",
    "decision_unit_id": "DU-001",
    "expires_at": "2026-08-30T12:00:00Z",
    "policy_sha256": "f4854d7fa05e5bddc21303350476bf47568bfe50f64c9d1f9199c0d744321bbf",
    "reason": "User explicitly approved action digest 7dcbd975b1721e6e314e8955b012aa7b5b82dcdacade06b1d428214c3e39c0dc for subject b7c7fb4a0bab1a2a4b0d9a59edfe237839f3779d as one H1 V2 targeted-mutation transaction; single-use, excluding CI simulation, H2, push, merge, deploy, credentials, network, external models and paid calls.",
    "schema_version": "1.0",
    "single_use": true,
    "spec_sha256": "657bac588589c0fabb9c8d6a108ab9077cd101c9648f55d0d3f5e71299f06877",
    "subject_commit": "b7c7fb4a0bab1a2a4b0d9a59edfe237839f3779d",
    "task_id": "TASK-0028"
  },
  {
    "actor": "human-user",
    "approval_type": "code",
    "approved_at": "2026-08-29T17:02:25Z",
    "base_commit": "3f3ead9eeb3cc1039be58627994a3a0d58102534",
    "decision_unit_id": "DU-001",
    "evidence_sha256": "a2589f30cdbf763fd930d924b2829f7ba2158ba4b4dd0841760dfd4af09e6d3b",
    "policy_sha256": "f4854d7fa05e5bddc21303350476bf47568bfe50f64c9d1f9199c0d744321bbf",
    "reason": "User approved H1 subject b7c7fb4a0bab1a2a4b0d9a59edfe237839f3779d based on final evidence SHA-256 4fc5729ef5e40f468b8966e35696a84e47b2de05e363d517293ac9e2f9823662 and implementation review REV-0056; approval is limited to the local read-only Gate and does not authorize CI simulation, temporary-directory operations, H2, push, merge, deploy, or close.",
    "schema_version": "1.0",
    "spec_sha256": "657bac588589c0fabb9c8d6a108ab9077cd101c9648f55d0d3f5e71299f06877",
    "subject_commit": "b7c7fb4a0bab1a2a4b0d9a59edfe237839f3779d",
    "task_id": "TASK-0028"
  },
  {
    "action_sha256": "f1d0fec813c2f8f00ede4ba2e9ff7b7c7d0882718f597714a266a5c46ebeb228",
    "actor": "human-user",
    "approval_type": "action",
    "approved_at": "2026-08-29T17:17:27Z",
    "base_commit": "3f3ead9eeb3cc1039be58627994a3a0d58102534",
    "decision_unit_id": "DU-001",
    "expires_at": "2026-08-31T12:00:00Z",
    "policy_sha256": "f4854d7fa05e5bddc21303350476bf47568bfe50f64c9d1f9199c0d744321bbf",
    "reason": "User explicitly approved canonical action digest f1d0fec813c2f8f00ede4ba2e9ff7b7c7d0882718f597714a266a5c46ebeb228 for one TASK-0028 H1 isolated CI simulation bound to subject b7c7fb4a0bab1a2a4b0d9a59edfe237839f3779d and code-approval attestation f35d3094a8385806abff2996691e5224bedb00e2; single-use, exact OS-temp targets and cleanup only, excluding H2, targeted mutation, push, merge, deploy, network, credentials, external models, paid calls and task close.",
    "schema_version": "1.0",
    "single_use": true,
    "spec_sha256": "657bac588589c0fabb9c8d6a108ab9077cd101c9648f55d0d3f5e71299f06877",
    "subject_commit": "b7c7fb4a0bab1a2a4b0d9a59edfe237839f3779d",
    "task_id": "TASK-0028"
  }
]
