[
  {
    "actor": "owner",
    "approval_type": "spec",
    "approved_at": "2026-09-22T13:31:19Z",
    "base_commit": "94b2a4f1b4cefb4c918c989d3c5ec41280e68cab",
    "decision_unit_id": "DU-001",
    "policy_sha256": "d21a386779147dfad962a0fc0656bef61bc581e27f63c4789dcc06520fa10ff1",
    "reason": "Recorded from the current owner instruction to close out and push the already completed work. Independent design review approves the exact fixed candidate and push-only scope; no new feature, PR, merge or E4 implementation is authorized. Formal V1, independent final review, Gate and precise fresh action approval remain required.",
    "schema_version": "1.0",
    "spec_sha256": "40dfbb63c906f058e151ce3846d6c524b14119aa926bd7dba51e477530ecf1ef",
    "subject_commit": "94b2a4f1b4cefb4c918c989d3c5ec41280e68cab",
    "task_id": "TASK-0053"
  },
  {
    "actor": "owner",
    "approval_type": "code",
    "approved_at": "2026-09-22T14:06:29Z",
    "base_commit": "94b2a4f1b4cefb4c918c989d3c5ec41280e68cab",
    "decision_unit_id": "DU-001",
    "evidence_sha256": "ef1697362d7de35d9a3e50404ba8fd6a48e57f6a0defaeeb7f311a9e433f35a7",
    "policy_sha256": "d21a386779147dfad962a0fc0656bef61bc581e27f63c4789dcc06520fa10ff1",
    "reason": "Recorded from the current explicit owner instruction to close out and push the completed work. This reviewed candidate only records the fixed publication scope; independent implementation review REV-0002 and all ten formal V1 checks passed. No PR, merge, E4 implementation or broader action is included. Exact fresh push action authorization is recorded separately.",
    "schema_version": "1.0",
    "spec_sha256": "40dfbb63c906f058e151ce3846d6c524b14119aa926bd7dba51e477530ecf1ef",
    "subject_commit": "94b2a4f1b4cefb4c918c989d3c5ec41280e68cab",
    "task_id": "TASK-0053"
  },
  {
    "action_sha256": "c7fe02635f1ca841c58d2d447be47c6d258f0739df63118b6ad1e552a9bc820c",
    "actor": "owner",
    "approval_type": "action",
    "approved_at": "2026-09-22T14:11:59Z",
    "base_commit": "94b2a4f1b4cefb4c918c989d3c5ec41280e68cab",
    "decision_unit_id": "DU-001",
    "expires_at": "2026-09-22T14:31:58Z",
    "policy_sha256": "d21a386779147dfad962a0fc0656bef61bc581e27f63c4789dcc06520fa10ff1",
    "reason": "Record the current explicit owner push instruction for this single reviewed candidate and exact existing remote feature branch. Freshness, target, expiry and single execution are checked by the operator before the ordinary push; no PR or merge.",
    "schema_version": "1.0",
    "single_use": true,
    "spec_sha256": "40dfbb63c906f058e151ce3846d6c524b14119aa926bd7dba51e477530ecf1ef",
    "subject_commit": "94b2a4f1b4cefb4c918c989d3c5ec41280e68cab",
    "task_id": "TASK-0053"
  }
]
