[
  {
    "actor": "project-owner",
    "approval_type": "spec",
    "approved_at": "2026-10-11T04:53:22Z",
    "base_commit": "8fb09e953d4a5ab1087ad4a561bd56d948370984",
    "decision_unit_id": "DU-001",
    "policy_sha256": "5dd060a85532a77fe64e318647c495056aa602acac27a145a7f50ddfaa26f3d6",
    "reason": "项目所有者于 2026-10-11 明确回复“可以，按照这个计划来”，批准按已说明的计划推进 TASK-0076；当前冻结规格 0314f80d794b65e6dafdad019d1d0c7cc795af2be602a559337b4a6fa780130b，独立 Design Review REV-0001 APPROVE、零发现，REVIEW/V1。后续 code、本地 action 与发布按常设授权条件执行。",
    "schema_version": "1.0",
    "spec_sha256": "0314f80d794b65e6dafdad019d1d0c7cc795af2be602a559337b4a6fa780130b",
    "subject_commit": "8fb09e953d4a5ab1087ad4a561bd56d948370984",
    "task_id": "TASK-0076"
  },
  {
    "actor": "project-owner",
    "approval_type": "code",
    "approved_at": "2026-10-11T05:23:27Z",
    "base_commit": "8fb09e953d4a5ab1087ad4a561bd56d948370984",
    "decision_unit_id": "DU-001",
    "evidence_sha256": "c3cc6f79f2d886ad526398d5e1175e83064dd5f22f8bf31e74d2ab8baf112674",
    "policy_sha256": "5dd060a85532a77fe64e318647c495056aa602acac27a145a7f50ddfaa26f3d6",
    "reason": "常设授权：独立实现审核 REV-0002 与 REV-0003 均 APPROVE、零发现；原生 V1 verify passed，1804 项全量测试通过、总覆盖率 88.49%、diff coverage 100%、全部必需检查通过。变更无外部副作用，AGENTS 仅补齐升级清单且常设授权一节未改；按 2026-10-10 常设授权记录 code 批准。",
    "schema_version": "1.0",
    "spec_sha256": "0314f80d794b65e6dafdad019d1d0c7cc795af2be602a559337b4a6fa780130b",
    "subject_commit": "8b9fa19d64f980b022e74e159c6d04f74a0fe984",
    "task_id": "TASK-0076"
  }
]
